<places
        xmlns="http://ramify.net/places"
        xmlns:xsi="http://www.w3.org/2001/XMLSchema-instance"
        xsi:schemaLocation="http://ramify.net/places ../../../../../schema/places.xsd">

    <township id="stansfield">

        <church id="cross_stone" name="St Pauls"/>

        <village id="blackshaw_head" name="Blackshaw Head">
            <church id="blackshaw_head_chapel" name="Blackshaw Head Chapel"/>
        </village>

        <hamlet id="eastwood" name="Eastwood">
            <church id="eastwood" name="Eastwood"/>
        </hamlet>

        <hamlet id="shore" name="Shore">
            <church id="shore" name="Shore"/>
            <farmstead id="parrock" name="Parrock"/>
            <farmstead id="west_bar" name="West Bar"/>
        </hamlet>

        <hamlet id="rawtonstall" name="Rawtonstall"/>

    </township>

    <town id="todmorden">

        <church id="roomfield" name="Roomfield"/>
        <church id="patmos" name="Patmos"/>

    </town>

</places>