<?xml version="1.0" encoding="UTF-8" ?>

<places
        xmlns="http://ramify.net/places"
        xmlns:xsi="http://www.w3.org/2001/XMLSchema-instance"
        xsi:schemaLocation="http://ramify.net/places ../../../schema/places.xsd">

    <county id="west_yorkshire">

        <manor id="wakefield" name="Wakefield">

            <graveship id="holme" name="Holme"/>

            <graveship id="sowerby" name="Sowerby">

                <manor id="halifax" name="Halifax"/>
                <manor id="midgley" name="Midgley"/>
                <manor id="sowerby" name="Sowerby"/>
                <manor id="warley" name="Warley"/>
                <manor id="ovenden" name="Ovenden"/>

                <manor id="heptonstall" name="Heptonstall"/>
                <manor id="langfield" name="Langfield"/>
                <manor id="stansfield" name="Stansfield"/>
                <manor id="wadsworth" name="Wadsworth"/>

            </graveship>

            <graveship id="wakefield" name="Wakefield"/>

        </manor>

    </county>

</places>